{
  "database": "industries",
  "schema_version": 1,
  "minimum_engine_version": "0.4.95",
  "last_updated": "2026-06-21",
  "record_count": 1,
  "records": [
    {
      "id": "industry_example",
      "name": "Example Industry",
      "production_type": "manufacturing",
      "input_resource_ids": [],
      "output_resource_ids": [],
      "metadata": {},
      "sources": [
        "Primary source"
      ],
      "confidence": "Verified",
      "verified": true,
      "notes": "",
      "future_extensions": {}
    }
  ]
}
